#
# Test table name
#
drop table if exists t1,t2,t3,t4,t5;
Warnings:
Note	1051	Unknown table 'test.t1'
Note	1051	Unknown table 'test.t2'
Note	1051	Unknown table 'test.t3'
Note	1051	Unknown table 'test.t4'
Note	1051	Unknown table 'test.t5'
drop database if exists mysqltest;
Warnings:
Note	1008	Can't drop database 'mysqltest'; database doesn't exist
drop view if exists v1;
Warnings:
Note	1051	Unknown table 'test.v1'
create table t1 (b char(0) not null)ENGINE=tianmu;
insert into t1 values (""),(null);
ERROR 23000: Column 'b' cannot be null
create table if not exists t1 (b char(0) not null)ENGINE=tianmu;
Warnings:
Note	1050	Table 't1' already exists
create table t1 (b char(0) not null)engine=tianmu;
ERROR 42S01: Table 't1' already exists
drop table t1;
create table `a/a` (a int)engine=tianmu;
show create table `a/a`;
Table	Create Table
a/a	CREATE TABLE `a/a` (
  `a` int(11) DEFAULT NULL
) ENGINE=TIANMU DEFAULT CHARSET=latin1
create table t1 like `a/a`;
drop table `a/a`,`t1`;
#
# Tests the long field name table
#
create table `aaaaaaaaaaaaaaaaaaaaaaaaaaaaaaaaaaaaaaaaaaaaaaaaaaaaaaaaaaaaaaaaaaa` (aaaaaaaaaaaaaaaaaaaaaaaaaaaaaaaaaaaaaaaaaaaaaaaaaaaaaaaaaaaaaaaaaa int)engine=tianmu;
ERROR 42000: Identifier name 'aaaaaaaaaaaaaaaaaaaaaaaaaaaaaaaaaaaaaaaaaaaaaaaaaaaaaaaaaaaaaaaaaaa' is too long
create table a (`aaaaaaaaaaaaaaaaaaaaaaaaaaaaaaaaaaaaaaaaaaaaaaaaaaaaaaaaaaaaaaaaaa` int)engine=tianmu;
ERROR 42000: Identifier name 'aaaaaaaaaaaaaaaaaaaaaaaaaaaaaaaaaaaaaaaaaaaaaaaaaaaaaaaaaaaaaaaaaa' is too long
create table t1 (a int default 100 auto_increment)engine=tianmu;
ERROR 42000: Invalid default value for 'a'
create table t1 (a tinyint default 1000)engine=tianmu;
ERROR 42000: Invalid default value for 'a'
create table t1 (a varchar(5) default 'abcdef')engine=tianmu;
ERROR 42000: Invalid default value for 'a'
create table t1 (a varchar(5) default 'abcde')engine=tianmu;
insert into t1 values();
select * from t1;
a
abcde
alter table t1 alter column a set default 'abcdef';
ERROR 42000: Invalid default value for 'a'
drop table t1;
#
# test of dummy table names
#
create table 1ea10 (1a20 int,1e int)engine=tianmu;
insert into 1ea10 values(1,1);
select 1ea10.1a20,1e+ 1e+10 from 1ea10;
1a20	1e+ 1e+10
1	10000000001
drop table 1ea10;
create table t1 (t1.index int)engine=tianmu;
drop table t1;
create database mysqltest;
use mysqltest;
create table mysqltest.test2$ (a int);
drop table mysqltest.test2$;
drop database mysqltest;
create table `` (a int)engine=tianmu;
ERROR 42000: Incorrect table name ''
drop table if exists ``;
ERROR 42000: Incorrect table name ''
use test;
create table t1 (`` int)engine=tianmu;
ERROR 42000: Incorrect column name ''
create table t1 (i int)engine=tianmu;
drop table t1;
#
# Test of CREATE ... select with indexes
#
create table t1 (a int auto_increment not null primary key, B CHAR(20))engine=tianmu;
insert into t1 (b) values ("hello"),("my"),("world");
explain select * from t1 where b="world";
id	select_type	table	partitions	type	possible_keys	key	key_len	ref	rows	filtered	Extra
1	SIMPLE	t1	NULL	ALL	NULL	NULL	NULL	NULL	3	33.33	Using where with pushed condition (`test`.`t1`.`B` = 'world')(t0) Pckrows: 1, susp. 1 (0 empty 0 full). Conditions: 1
Warnings:
Note	1003	/* select#1 */ select `test`.`t1`.`a` AS `a`,`test`.`t1`.`B` AS `B` from `test`.`t1` where (`test`.`t1`.`B` = 'world')
select * from t1 where b="world";
a	B
3	world
drop table t1;
#
# Test of primary key with 32 index
#
#
# Test default table type
#
set session default_storage_engine="tianmu";
select @@default_storage_engine;
@@default_storage_engine
TIANMU
create table t1 (a int not null);
show create table t1;
Table	Create Table
t1	CREATE TABLE `t1` (
  `a` int(11) NOT NULL
) ENGINE=TIANMU DEFAULT CHARSET=latin1
drop table t1;
set session default_storage_engine="gemini";
ERROR 42000: Unknown storage engine 'gemini'
set session default_storage_engine=default;
create table t1 ( k1 varchar(2), k2 int, primary key(k1,k2))engine=tianmu;
insert into t1 values ("a", 1), ("b", 2);
insert into t1 values ("c", NULL);
ERROR 23000: Column 'k2' cannot be null
insert into t1 values (NULL, 3);
ERROR 23000: Column 'k1' cannot be null
insert into t1 values (NULL, NULL);
ERROR 23000: Column 'k1' cannot be null
drop table t1;
create table t1 select x'4132';
create table t1 select 1,2,3;
ERROR 42S01: Table 't1' already exists
create table if not exists t1 select 1,2;
Warnings:
Note	1050	Table 't1' already exists
create table if not exists t1 select 1,2,3,4;
Warnings:
Note	1050	Table 't1' already exists
create table if not exists t1 select 1;
Warnings:
Note	1050	Table 't1' already exists
select * from t1;
x'4132'
A2
drop table t1;
#
# "Table truncated when creating another table name with Spaces"
#
create table `t1 `(a int)engine=tianmu;
ERROR 42000: Incorrect table name 't1 '
create database `db1 `;
ERROR 42000: Incorrect database name 'db1 '
create table t1(`a ` int)engine=tianmu;
ERROR 42000: Incorrect column name 'a '
#
# "Parser permits multiple commas without syntax error"
#
create table t1 (a int,)engine=tianmu;
ERROR 42000: You have an error in your SQL syntax; check the manual that corresponds to your MySQL server version for the right syntax to use near ')engine=tianmu' at line 1
create table t1 (a int,,b int)engine=tianmu;
ERROR 42000: You have an error in your SQL syntax; check the manual that corresponds to your MySQL server version for the right syntax to use near 'b int)engine=tianmu' at line 1
create table t1 (,b int)engine=tianmu;
ERROR 42000: You have an error in your SQL syntax; check the manual that corresponds to your MySQL server version for the right syntax to use near 'b int)engine=tianmu' at line 1
#
# Test create with foreign keys
#
drop table if exists t1;
Warnings:
Note	1051	Unknown table 'test.t1'
#
# Test for create table .. LIKE ..
#
create table t1(id int not null, name char(20))engine=tianmu;
insert into t1 values(10,'mysql'),(20,'monty- the creator');
create table t2(id int not null)engine=tianmu;
insert into t2 values(10),(20);
create table t3 like t1;
show create table t3;
Table	Create Table
t3	CREATE TABLE `t3` (
  `id` int(11) NOT NULL,
  `name` char(20) DEFAULT NULL
) ENGINE=TIANMU DEFAULT CHARSET=latin1
select * from t3;
id	name
create table if not exists t3 like t1;
Warnings:
Note	1050	Table 't3' already exists
select @@warning_count;
@@warning_count
1
create table non_existing_database.t1 like t1;
ERROR 42000: Unknown database 'non_existing_database'
create table t3 like non_existing_table;
ERROR 42S02: Table 'test.non_existing_table' doesn't exist
drop table t1,t3;
#
# Test types of data for create select with functions
#
create table t1(a int,b int,c int,
d date,e char,f datetime,g time,
h blob)engine=tianmu;
insert into t1(a)values(1);
insert into t1(a,b,c,d,e,f,g,h)values(2,-2,2,'1825-12-14','a','2003-1-1 3:2:1','4:3:2','binary data');
select * from t1;
a	b	c	d	e	f	g	h
1	NULL	NULL	NULL	NULL	NULL	NULL	NULL
2	-2	2	1825-12-14	a	2003-01-01 03:02:01	04:03:02	binary data
select a, 
ifnull(b,cast(-7 as signed)) as b, 
ifnull(c,cast(7 as unsigned)) as c, 
ifnull(d,cast('2000-01-01' as date)) as d, 
ifnull(e,cast('b' as char)) as e,
ifnull(f,cast('2000-01-01' as datetime)) as f, 
ifnull(g,cast('5:4:3' as time)) as g,
ifnull(h,cast('yet another binary data' as binary)) as h,
addtime(cast('1:0:0' as time),cast('1:0:0' as time)) as dd 
from t1;
a	b	c	d	e	f	g	h	dd
1	-7	7	2000-01-01	b	2000-01-01 00:00:00	05:04:03	yet another binary data	02:00:00
2	-2	2	1825-12-14	a	2003-01-01 03:02:01	04:03:02	binary data	02:00:00
explain t1;
Field	Type	Null	Key	Default	Extra
a	int(11)	YES		NULL	
b	int(11)	YES		NULL	
c	int(11)	YES		NULL	
d	date	YES		NULL	
e	char(1)	YES		NULL	
f	datetime	YES		NULL	
g	time	YES		NULL	
h	blob	YES		NULL	
drop table t1;
create table t1 (a tinyint, b smallint, c mediumint,
d int, e bigint, f float(3,2), g double(4,3),
h decimal(5,4), i year, j date,
k timestamp NOT NULL DEFAULT CURRENT_TIMESTAMP ON UPDATE CURRENT_TIMESTAMP,
l datetime, o char(10))engine=tianmu;
show create table t1;
Table	Create Table
t1	CREATE TABLE `t1` (
  `a` tinyint(4) DEFAULT NULL,
  `b` smallint(6) DEFAULT NULL,
  `c` mediumint(9) DEFAULT NULL,
  `d` int(11) DEFAULT NULL,
  `e` bigint(20) DEFAULT NULL,
  `f` float(3,2) DEFAULT NULL,
  `g` double(4,3) DEFAULT NULL,
  `h` decimal(5,4) DEFAULT NULL,
  `i` year(4) DEFAULT NULL,
  `j` date DEFAULT NULL,
  `k` timestamp NOT NULL DEFAULT CURRENT_TIMESTAMP ON UPDATE CURRENT_TIMESTAMP,
  `l` datetime DEFAULT NULL,
  `o` char(10) DEFAULT NULL
) ENGINE=TIANMU DEFAULT CHARSET=latin1
drop table t1;
create table t1(str varchar(10) default 'def',strnull varchar(10),
intg int default '10',rel double default '3.14')engine=tianmu;
insert into t1 values ('','',0,0.0);
describe t1;
Field	Type	Null	Key	Default	Extra
str	varchar(10)	YES		def	
strnull	varchar(10)	YES		NULL	
intg	int(11)	YES		10	
rel	double	YES		3.14	
drop table t1;
create table t1(name varchar(10), age smallint default -1);
describe t2;
Field	Type	Null	Key	Default	Extra
id	int(11)	NO		NULL	
drop table t1,t2;
#
# 'Naming a key "Primary" causes trouble'
#
#
#Can't use 'DEFAULT FALSE' for column of type bool
#
create table t1 (b bool not null default false)engine=tianmu;
create table t2 (b bool not null default true)engine=tianmu;
insert into t1 values ();
insert into t2 values ();
select * from t1;
b
0
select * from t2;
b
1
drop table t1,t2;
#
# Invalid column name is not rejected
#
create database syw_mtr;
use syw_mtr;
create table t1(column.name int)engine=tianmu;
ERROR 42000: Incorrect table name 'column'
create table t1(test.column.name int)engine=tianmu;
ERROR 42000: Incorrect database name 'test'
create table t1(xyz.t1.name int)engine=tianmu;
ERROR 42000: Incorrect database name 'xyz'
create table t1(t1.name int)engine=tianmu;
create table t2(syw_mtr.t2.name int)engine=tianmu;
drop table t1,t2;
drop database syw_mtr;
#
#create table like
#
use test;
create table test.t1 like x;
ERROR 42S02: Table 'test.x' doesn't exist
drop table if exists test.t1;
Warnings:
Note	1051	Unknown table 'test.t1'
#
#Bogus error message on attempt to create table t LIKE view
#
create database mysqltest;
use mysqltest;
create view v1 as select 'foo' from dual;
create table t1 like v1;
ERROR HY000: 'mysqltest.v1' is not BASE TABLE
drop view v1;
drop database mysqltest;
#
#SET value having comma not correctly handled
#
use test;
create table t1(a set("a,b","c,d") not null);
ERROR 22007: Illegal set 'a,b' value found during parsing
#
#mysqld segfault when trying to create table with same name as existing view
#
create table t1 (a int);
create table t2 (a int);
insert into t1 values (1),(2),(3);
insert into t2 values (1),(2),(3);
create view v1 as select t1.a FROM t1, t2;
create table v1 as select * FROM t1;
ERROR 42S01: Table 'v1' already exists
drop view v1;
drop table t1,t2;
SET sql_mode = 'NO_ZERO_DATE';
Warnings:
Warning	3135	'NO_ZERO_DATE', 'NO_ZERO_IN_DATE' and 'ERROR_FOR_DIVISION_BY_ZERO' sql modes should be used with strict mode. They will be merged with strict mode in a future release.
Warning	3090	Changing sql mode 'NO_AUTO_CREATE_USER' is deprecated. It will be removed in a future release.
create table t2(c1 TIMESTAMP, c2 TIMESTAMP DEFAULT 0);
Warnings:
Warning	1264	Out of range value for column 'c2' at row 1
drop table t2;
create table t2(c1 TIMESTAMP NULL);
SET sql_mode = '';
drop table t2;
#
#Tests the default type of year for the created table and inserts a null value
#
create table t1(c1 year default 2008, c2 year default 0);
SHOW create table t1;
Table	Create Table
t1	CREATE TABLE `t1` (
  `c1` year(4) DEFAULT '2008',
  `c2` year(4) DEFAULT '0000'
) ENGINE=TIANMU DEFAULT CHARSET=latin1
insert into t1 values();
select * FROM t1;
c1	c2
2008	0000
drop table t1;
#
# Attempt to create table with invalid default should fail in normal mode
#
create table t1 (dt datetime default '2008-02-31 00:00:00');
ERROR 42000: Invalid default value for 'dt'
set @old_mode= @@sql_mode;
set @@sql_mode='ALLOW_INVALID_DATES';
# The same should be possible in relaxed mode
create table t1 (dt datetime default '2008-02-31 00:00:00');
set @@sql_mode= @old_mode;
create table t2 like t1;
ERROR 42000: Invalid default value for 'dt'
set @@sql_mode='ALLOW_INVALID_DATES';
create table t2 like t1;
show create table t1;
Table	Create Table
t1	CREATE TABLE `t1` (
  `dt` datetime DEFAULT '2008-02-31 00:00:00'
) ENGINE=TIANMU DEFAULT CHARSET=latin1
show create table t2;
Table	Create Table
t2	CREATE TABLE `t2` (
  `dt` datetime DEFAULT '2008-02-31 00:00:00'
) ENGINE=TIANMU DEFAULT CHARSET=latin1
set @@sql_mode= @old_mode;
drop tables t1,t2;
#
# Creating a base table in presence of an updatable view.
# 
create table t2 (a int primary key);
create view t1 as select a from t2;
insert into t1 (a) values (1);
create table t1 (a int);
ERROR 42S01: Table 't1' already exists
create table if not exists t1 (a int);
Warnings:
Note	1050	Table 't1' already exists
create table t1 (a int) select 2 as a;
ERROR 42S01: Table 't1' already exists
select * from t1;
a
1
create table if not exists t1 (a int) select 2 as a;
Warnings:
Note	1050	Table 't1' already exists
select * from t1;
a
1
select * from t2;
a
1
create temporary table if not exists t1 (a int) select 3 as a;
select * from t1;
a
3
select * from t2;
a
1
drop table t1,t2;
drop view t1;
#
# Repeating the test with a view select a constant number
#
create view t1 as select 1 as a;
insert into t1 (a) values (1);
ERROR HY000: The target table t1 of the INSERT is not insertable-into
update t1 set a=3 where a=2;
ERROR HY000: The target table t1 of the UPDATE is not updatable
create table t1 (a int);
ERROR 42S01: Table 't1' already exists
create table if not exists t1 (a int);
Warnings:
Note	1050	Table 't1' already exists
create table t1 (a int) select 2 as a;
ERROR 42S01: Table 't1' already exists
select * from t1;
a
1
create table if not exists t1 (a int) select 2 as a;
Warnings:
Note	1050	Table 't1' already exists
select * from t1;
a
1
create temporary table if not exists t1 (a int) select 3 as a;
select * from t1;
a
3
create temporary table if not exists t1 (a int) select 4 as a;
Warnings:
Note	1050	Table 't1' already exists
select * from t1;
a
3
drop temporary table t1;
drop view t1;
# Test cases added for coverage.
create table t1(fld1 DATETIME NOT NULL DEFAULT '1111:11:11');
show create table t1;
Table	Create Table
t1	CREATE TABLE `t1` (
  `fld1` datetime NOT NULL DEFAULT '1111-11-11 00:00:00'
) ENGINE=TIANMU DEFAULT CHARSET=latin1
drop table t1;
# create table..select based on trigger fields.
create table t1 (fld1 int, fld2 DATETIME DEFAULT '1211:1:1');
show create table t1;
Table	Create Table
t1	CREATE TABLE `t1` (
  `fld1` int(11) DEFAULT NULL,
  `fld2` datetime DEFAULT '1211-01-01 00:00:00'
) ENGINE=TIANMU DEFAULT CHARSET=latin1
# error of support type
create table t_unsupport_type (a2 json DEFAULT NULL);
ERROR HY000: Unsupported data type[json]
drop table if exists bittypes;
Warnings:
Note	1051	Unknown table 'test.bittypes'
create table bittypes (
id int not null primary key,
bit1 bit(1),
bit2 bit(2),
bit4 bit(4),
bit8 bit(8),
bit16 bit(16),
bit32 bit(32),
bit63 bit(63)
) ENGINE=tianmu DEFAULT CHARSET=utf8mb4;
show create table bittypes;
Table	Create Table
bittypes	CREATE TABLE `bittypes` (
  `id` int(11) NOT NULL,
  `bit1` bit(1) DEFAULT NULL,
  `bit2` bit(2) DEFAULT NULL,
  `bit4` bit(4) DEFAULT NULL,
  `bit8` bit(8) DEFAULT NULL,
  `bit16` bit(16) DEFAULT NULL,
  `bit32` bit(32) DEFAULT NULL,
  `bit63` bit(63) DEFAULT NULL,
  PRIMARY KEY (`id`)
) ENGINE=TIANMU DEFAULT CHARSET=utf8mb4
drop table bittypes;
create table tc(a bit(64)) engine=tianmu;
ERROR HY000: The bit(M) type, M must be less than or equal to 63 in tianmu engine.
