#
# DELETE FROM TABLE_NAME
#
DROP DATABASE IF EXISTS delete_all_rows;
CREATE DATABASE delete_all_rows;
use delete_all_rows;
CREATE TABLE `column_type_test` (
`c_tinyint` tinyint DEFAULT NULL COMMENT 'tinyint',
`c_smallint` smallint DEFAULT NULL COMMENT 'smallint',
`c_mediumint` mediumint DEFAULT NULL COMMENT 'mediumint',
`c_int` int DEFAULT NULL COMMENT 'int',
`c_bigint` bigint DEFAULT NULL COMMENT 'bigint',
`c_float` float DEFAULT NULL COMMENT 'float',
`c_double` double DEFAULT NULL COMMENT 'double',
`c_decimal` decimal(10,5) DEFAULT NULL COMMENT 'decimal',
`c_date` date DEFAULT NULL COMMENT 'date',
`c_datetime` datetime DEFAULT NULL COMMENT 'datetime',
`c_timestamp` timestamp NULL DEFAULT NULL COMMENT 'timestamp',
`c_time` time DEFAULT NULL COMMENT 'time',
`c_char` char(10) DEFAULT NULL COMMENT 'char',
`c_varchar` varchar(10) DEFAULT NULL COMMENT 'varchar',
`c_blob` blob COMMENT 'blob',
`c_text` text COMMENT 'text',
`c_longblob` longblob COMMENT 'longblob'
) ENGINE=TIANMU DEFAULT CHARSET=utf8mb4 COLLATE=utf8mb4_0900_ai_ci;
#
# DELETE FROM TABLE_NAME for Large amount of data
#
load data infile '../../std_data/tianmu/bigdata4load' into table column_type_test fields terminated by '|';
select count(*) from column_type_test;
count(*)
100000
select max(c_int) from column_type_test;
max(c_int)
104
select min(c_int) from column_type_test;
min(c_int)
100
select avg(c_int) from column_type_test;
avg(c_int)
102.0000
select sum(c_int) from column_type_test;
sum(c_int)
10200000
delete from column_type_test where c_tinyint=100 limit 1000;
show create table column_type_test;
Table	Create Table
column_type_test	CREATE TABLE `column_type_test` (
  `c_tinyint` tinyint DEFAULT NULL COMMENT 'tinyint',
  `c_smallint` smallint DEFAULT NULL COMMENT 'smallint',
  `c_mediumint` mediumint DEFAULT NULL COMMENT 'mediumint',
  `c_int` int DEFAULT NULL COMMENT 'int',
  `c_bigint` bigint DEFAULT NULL COMMENT 'bigint',
  `c_float` float DEFAULT NULL COMMENT 'float',
  `c_double` double DEFAULT NULL COMMENT 'double',
  `c_decimal` decimal(10,5) DEFAULT NULL COMMENT 'decimal',
  `c_date` date DEFAULT NULL COMMENT 'date',
  `c_datetime` datetime DEFAULT NULL COMMENT 'datetime',
  `c_timestamp` timestamp NULL DEFAULT NULL COMMENT 'timestamp',
  `c_time` time DEFAULT NULL COMMENT 'time',
  `c_char` char(10) DEFAULT NULL COMMENT 'char',
  `c_varchar` varchar(10) DEFAULT NULL COMMENT 'varchar',
  `c_blob` blob COMMENT 'blob',
  `c_text` text COMMENT 'text',
  `c_longblob` longblob COMMENT 'longblob'
) ENGINE=TIANMU DEFAULT CHARSET=utf8mb4 COLLATE=utf8mb4_0900_ai_ci
select count(*) from column_type_test;
count(*)
99000
select max(c_int) from column_type_test;
max(c_int)
104
select min(c_int) from column_type_test;
min(c_int)
100
select avg(c_int) from column_type_test;
avg(c_int)
102.0202
select sum(c_int) from column_type_test;
sum(c_int)
10100000
#
# DELETE FROM TABLE_NAME for select/insert/Aggregate query
#
#
# DELETE FROM column_type_test spend too much time, optimize it later
#
drop table column_type_test;
CREATE TABLE `column_type_test` (
`c_tinyint` tinyint DEFAULT NULL COMMENT 'tinyint',
`c_smallint` smallint DEFAULT NULL COMMENT 'smallint',
`c_mediumint` mediumint DEFAULT NULL COMMENT 'mediumint',
`c_int` int DEFAULT NULL COMMENT 'int',
`c_bigint` bigint DEFAULT NULL COMMENT 'bigint',
`c_float` float DEFAULT NULL COMMENT 'float',
`c_double` double DEFAULT NULL COMMENT 'double',
`c_decimal` decimal(10,5) DEFAULT NULL COMMENT 'decimal',
`c_date` date DEFAULT NULL COMMENT 'date',
`c_datetime` datetime DEFAULT NULL COMMENT 'datetime',
`c_timestamp` timestamp NULL DEFAULT NULL COMMENT 'timestamp',
`c_time` time DEFAULT NULL COMMENT 'time',
`c_char` char(10) DEFAULT NULL COMMENT 'char',
`c_varchar` varchar(10) DEFAULT NULL COMMENT 'varchar',
`c_blob` blob COMMENT 'blob',
`c_text` text COMMENT 'text',
`c_longblob` longblob COMMENT 'longblob'
) ENGINE=TIANMU DEFAULT CHARSET=utf8mb4 COLLATE=utf8mb4_0900_ai_ci;
insert into column_type_test(c_tinyint,c_smallint,c_mediumint,c_int,c_bigint,c_float,c_double,c_decimal,c_date,c_datetime,c_timestamp,c_time,c_char,c_varchar,c_text)
values(105,105,105,105,105,5.2,10.88,105.083,'2016-02-25','2016-02-25 10:20:01','2016-02-25 05:20:01','10:20:01','stoneatom','hello','bcdefghijklmn');
select * from column_type_test;
c_tinyint	c_smallint	c_mediumint	c_int	c_bigint	c_float	c_double	c_decimal	c_date	c_datetime	c_timestamp	c_time	c_char	c_varchar	c_blob	c_text	c_longblob
105	105	105	105	105	5.2	10.88	105.08300	2016-02-25	2016-02-25 10:20:01	2016-02-25 05:20:01	10:20:01	stoneatom	hello	NULL	bcdefghijklmn	NULL
select count(*) from column_type_test;
count(*)
1
select max(c_int) from column_type_test;
max(c_int)
105
select min(c_int) from column_type_test;
min(c_int)
105
select avg(c_int) from column_type_test;
avg(c_int)
105.0000
select sum(c_int) from column_type_test;
sum(c_int)
105
delete from column_type_test;
select * from column_type_test;
c_tinyint	c_smallint	c_mediumint	c_int	c_bigint	c_float	c_double	c_decimal	c_date	c_datetime	c_timestamp	c_time	c_char	c_varchar	c_blob	c_text	c_longblob
select count(*) from column_type_test;
count(*)
0
select max(c_int) from column_type_test;
max(c_int)
NULL
select min(c_int) from column_type_test;
min(c_int)
NULL
select avg(c_int) from column_type_test;
avg(c_int)
NULL
select sum(c_int) from column_type_test;
sum(c_int)
NULL
drop table column_type_test;
#
# DELETE FROM TABLE_NAME for primary key
#
CREATE TABLE t1(c1 int,c2 varchar(255),primary key(c1))ENGINE=TIANMU DEFAULT CHARSET=utf8mb4 COLLATE=utf8mb4_0900_ai_ci;
insert into t1 values(1,'test1');
insert into t1 values(2,'test2');
delete from t1;
select * from t1;
c1	c2
insert into t1 values(1,'test1');
insert into t1 values(2,'test2');
select * from t1;
c1	c2
1	test1
2	test2
delete from t1;
drop table t1;
CREATE TABLE t1 (a tinyint, b tinyint)ENGINE=TIANMU DEFAULT CHARSET=utf8mb4 COLLATE=utf8mb4_0900_ai_ci;
INSERT INTO t1 VALUES (1,1);
INSERT LOW_PRIORITY INTO t1 VALUES (1,2);
INSERT INTO t1 VALUES (1,3);
DELETE from t1 where a=1 limit 1;
DELETE LOW_PRIORITY from t1 where a=1;
INSERT INTO t1 VALUES (1,1);
DELETE from t1;
INSERT INTO t1 VALUES (1,2);
DELETE from t1;
INSERT INTO t1 VALUES (1,2);
SET AUTOCOMMIT=0;
DELETE from t1;
SET AUTOCOMMIT=1;
drop table t1;
#
# Adds some test cases for unicode. such as insert unicode chars, in values, table name, or etc.
#
CREATE TABLE `abc def` (i int)engine=tianmu;
INSERT INTO `abc def` VALUES (1);
delete from `abc def`;
drop table `abc def`;
CREATE TABLE t1 (`abc def1` tinyint, `abc def2` tinyint)ENGINE=TIANMU DEFAULT CHARSET=utf8mb4 COLLATE=utf8mb4_0900_ai_ci;
INSERT INTO t1 VALUES (1,1);
DELETE from t1;
INSERT INTO t1 VALUES (1,2);
DELETE from t1;
INSERT INTO t1 VALUES (1,2);
SET AUTOCOMMIT=0;
DELETE from t1;
SET AUTOCOMMIT=1;
drop table t1;
DROP DATABASE delete_all_rows;
