DROP DATABASE IF EXISTS issue581_test;
CREATE DATABASE issue581_test;
USE issue581_test;
DROP TABLE IF EXISTS t1,t2;
CREATE TABLE t1 (id INT PRIMARY KEY, copy INT) ENGINE=TIANMU;
CREATE TABLE t2 (id INT PRIMARY KEY, data INT) ENGINE=TIANMU;
CREATE trigger t1_bi before insert on t1 for each row
set new.copy= (SELECT data FROM t2 where id = new.id);
CREATE trigger t1_bu before UPDATE on t1 for each row
set new.copy= (SELECT data FROM t2 where id = new.id);
INSERT INTO t2 VALUES (1,1), (2,2);
SELECT * FROM t1;
id	copy
SELECT * FROM t2;
id	data
1	1
2	2
INSERT INTO t1 VALUES (1,3), (2,4), (3,3);
SELECT * FROM t1;
id	copy
1	1
2	2
3	NULL
SELECT * FROM t2;
id	data
1	1
2	2
UPDATE t1 set copy= 1 where id = 2;
SELECT * FROM t1;
id	copy
1	1
2	2
3	NULL
SELECT * FROM t2;
id	data
1	1
2	2
UPDATE t1 set copy= 1 where id = 3;
SELECT * FROM t1;
id	copy
1	1
2	2
3	NULL
SELECT * FROM t2;
id	data
1	1
2	2
DROP TABLE IF EXISTS t1,t2;
DROP DATABASE issue581_test;
