#
# UPDATE decimal and DElETE WHERE
#
DROP DATABASE IF EXISTS update_signed_test;
CREATE DATABASE update_signed_test;
USE update_signed_test;
DROP PROCEDURE IF EXISTS signedinsertproc;
DROP PROCEDURE IF EXISTS signeddeleteproc;
CREATE PROCEDURE signedinsertproc ()
BEGIN
INSERT INTO cs1 VALUES (125, 125);
INSERT INTO cs1 VALUES (-125, -125);
INSERT INTO cs1 values (99998, 9998);
INSERT INTO cs1 values (99999, 9999);
INSERT INTO cs1 values (-99998, -9998);
INSERT INTO cs1 values (-99999, -9999);
INSERT INTO cs1 VALUES (0, 0);
INSERT INTO cs1 VALUES (NULL, NULL);
INSERT INTO cs2 VALUES (1.25, 1.25);
INSERT INTO cs2 VALUES (-1.25, -1.25);
INSERT INTO cs2 values (99999.99998, 99999.99998);
INSERT INTO cs2 values (99999.99999, 99999.99999);
INSERT INTO cs2 values (-99999.99998, -99999.99998);
INSERT INTO cs2 values (-99999.99999, -99999.99999);
INSERT INTO cs2 VALUES (1.1234567891, 1.1234567891);
INSERT INTO cs2 VALUES (1.99999, 1.99999);
INSERT INTO cs2 VALUES (-1.1234567891, -1.1234567891);
INSERT INTO cs2 VALUES (-1.99999, -1.99999);
INSERT INTO cs2 VALUES (1.0000000009, 1.0000000009);
INSERT INTO cs2 VALUES (-1.0000000009, -1.0000000009);
INSERT INTO cs2 VALUES (0, 0);
INSERT INTO cs2 VALUES (NULL, NULL);
INSERT INTO cs3 VALUES (0.125, 0.125);
INSERT INTO cs3 VALUES (-0.125, -0.125);
INSERT INTO cs3 values (0.99998, 0.9998);
INSERT INTO cs3 values (0.99999, 0.9999);
INSERT INTO cs3 values (-0.99998, -0.9998);
INSERT INTO cs3 values (-0.99999, -0.9999);
INSERT INTO cs3 VALUES (0.12345, 0.1234);
INSERT INTO cs3 VALUES (0.19999, 0.1999);
INSERT INTO cs3 VALUES (-0.12345, -0.1234);
INSERT INTO cs3 VALUES (-0.19999, -0.1999);
INSERT INTO cs3 VALUES (0.00009, 0.0009);
INSERT INTO cs3 VALUES (-0.00009, -0.0009);
INSERT INTO cs3 VALUES (0, 0);
INSERT INTO cs3 VALUES (NULL, NULL);
END//
CREATE PROCEDURE signeddeleteproc ()
BEGIN
DELETE FROM cs1;
DELETE FROM cs2;
DELETE FROM cs3;
END//
DROP TABLE IF EXISTS cs1;
Warnings:
Note	1051	Unknown table 'update_signed_test.cs1'
DROP TABLE IF EXISTS cs2;
Warnings:
Note	1051	Unknown table 'update_signed_test.cs2'
DROP TABLE IF EXISTS cs3;
Warnings:
Note	1051	Unknown table 'update_signed_test.cs3'
CREATE TABLE cs1 (d1 DECIMAL(18), d2 DECIMAL(18));
CREATE TABLE cs2 (d1 DECIMAL(18,10), d2 DECIMAL(18,10));
CREATE TABLE cs3 (d1 DECIMAL(18,10), d2 DECIMAL(18,10));
CALL signedinsertproc();
UPDATE cs1 SET d1=12345, d2=1234;
UPDATE cs2 SET d1=123456.90123, d2=12345.01234;
UPDATE cs3 SET d1=0.12345, d2=0.1234;
SELECT "signedtest1", d1, d2 FROM cs1;
signedtest1	d1	d2
signedtest1	12345	1234
signedtest1	12345	1234
signedtest1	12345	1234
signedtest1	12345	1234
signedtest1	12345	1234
signedtest1	12345	1234
signedtest1	12345	1234
signedtest1	12345	1234
SELECT "signedtest1", d1, d2 FROM cs2;
signedtest1	d1	d2
signedtest1	123456.9012300000	12345.0123400000
signedtest1	123456.9012300000	12345.0123400000
signedtest1	123456.9012300000	12345.0123400000
signedtest1	123456.9012300000	12345.0123400000
signedtest1	123456.9012300000	12345.0123400000
signedtest1	123456.9012300000	12345.0123400000
signedtest1	123456.9012300000	12345.0123400000
signedtest1	123456.9012300000	12345.0123400000
signedtest1	123456.9012300000	12345.0123400000
signedtest1	123456.9012300000	12345.0123400000
signedtest1	123456.9012300000	12345.0123400000
signedtest1	123456.9012300000	12345.0123400000
signedtest1	123456.9012300000	12345.0123400000
signedtest1	123456.9012300000	12345.0123400000
SELECT "signedtest1", d1, d2 FROM cs3;
signedtest1	d1	d2
signedtest1	0.1234500000	0.1234000000
signedtest1	0.1234500000	0.1234000000
signedtest1	0.1234500000	0.1234000000
signedtest1	0.1234500000	0.1234000000
signedtest1	0.1234500000	0.1234000000
signedtest1	0.1234500000	0.1234000000
signedtest1	0.1234500000	0.1234000000
signedtest1	0.1234500000	0.1234000000
signedtest1	0.1234500000	0.1234000000
signedtest1	0.1234500000	0.1234000000
signedtest1	0.1234500000	0.1234000000
signedtest1	0.1234500000	0.1234000000
signedtest1	0.1234500000	0.1234000000
signedtest1	0.1234500000	0.1234000000
CALL signeddeleteproc();
CALL signedinsertproc();
UPDATE cs1 SET d1=12345, d2=0 WHERE d1=-99998;
UPDATE cs1 SET d1=0, d2=12345 WHERE d2=9999;
UPDATE cs2 SET d1=123456.90123, d2=0 WHERE d1=-99999.99998;
UPDATE cs2 SET d1=0, d2=12345.012345678 WHERE d2=99999.99999;
UPDATE cs3 SET d1=0.12345, d2=0 WHERE d1=-0.99998;
UPDATE cs3 SET d1=0, d2=0.12345 WHERE d2=0.9999;
SELECT "signedtest2", d1, d2 FROM cs1;
signedtest2	d1	d2
signedtest2	125	125
signedtest2	-125	-125
signedtest2	99998	9998
signedtest2	0	12345
signedtest2	12345	0
signedtest2	-99999	-9999
signedtest2	0	0
signedtest2	NULL	NULL
SELECT "signedtest2", d1, d2 FROM cs2;
signedtest2	d1	d2
signedtest2	1.2500000000	1.2500000000
signedtest2	-1.2500000000	-1.2500000000
signedtest2	99999.9999800000	99999.9999800000
signedtest2	0.0000000000	12345.0123456780
signedtest2	123456.9012300000	0.0000000000
signedtest2	-99999.9999900000	-99999.9999900000
signedtest2	1.1234567891	1.1234567891
signedtest2	1.9999900000	1.9999900000
signedtest2	-1.1234567891	-1.1234567891
signedtest2	-1.9999900000	-1.9999900000
signedtest2	1.0000000009	1.0000000009
signedtest2	-1.0000000009	-1.0000000009
signedtest2	0.0000000000	0.0000000000
signedtest2	NULL	NULL
SELECT "signedtest2", d1, d2 FROM cs3;
signedtest2	d1	d2
signedtest2	0.1250000000	0.1250000000
signedtest2	-0.1250000000	-0.1250000000
signedtest2	0.9999800000	0.9998000000
signedtest2	0.0000000000	0.1234500000
signedtest2	0.1234500000	0.0000000000
signedtest2	-0.9999900000	-0.9999000000
signedtest2	0.1234500000	0.1234000000
signedtest2	0.1999900000	0.1999000000
signedtest2	-0.1234500000	-0.1234000000
signedtest2	-0.1999900000	-0.1999000000
signedtest2	0.0000900000	0.0009000000
signedtest2	-0.0000900000	-0.0009000000
signedtest2	0.0000000000	0.0000000000
signedtest2	NULL	NULL
CALL signeddeleteproc();
CALL signedinsertproc();
UPDATE cs1 SET d1=12345, d2=1234 WHERE d1 < -99998 OR d2 > 9998;
UPDATE cs2 SET d1=123456.90123, d2=12345.01234 WHERE d1 < -99999.99998 OR d2 > 99999.99998;
UPDATE cs3 SET d1=0.12345, d2=0.1234 WHERE d1 < -0.99998 OR d2 > 0.9998;
SELECT "signedtest4a", d1, d2 FROM cs1;
signedtest4a	d1	d2
signedtest4a	125	125
signedtest4a	-125	-125
signedtest4a	99998	9998
signedtest4a	12345	1234
signedtest4a	-99998	-9998
signedtest4a	12345	1234
signedtest4a	0	0
signedtest4a	NULL	NULL
SELECT "signedtest4a", d1, d2 FROM cs2;
signedtest4a	d1	d2
signedtest4a	1.2500000000	1.2500000000
signedtest4a	-1.2500000000	-1.2500000000
signedtest4a	99999.9999800000	99999.9999800000
signedtest4a	123456.9012300000	12345.0123400000
signedtest4a	-99999.9999800000	-99999.9999800000
signedtest4a	123456.9012300000	12345.0123400000
signedtest4a	1.1234567891	1.1234567891
signedtest4a	1.9999900000	1.9999900000
signedtest4a	-1.1234567891	-1.1234567891
signedtest4a	-1.9999900000	-1.9999900000
signedtest4a	1.0000000009	1.0000000009
signedtest4a	-1.0000000009	-1.0000000009
signedtest4a	0.0000000000	0.0000000000
signedtest4a	NULL	NULL
SELECT "signedtest4a", d1, d2 FROM cs3;
signedtest4a	d1	d2
signedtest4a	0.1250000000	0.1250000000
signedtest4a	-0.1250000000	-0.1250000000
signedtest4a	0.9999800000	0.9998000000
signedtest4a	0.1234500000	0.1234000000
signedtest4a	-0.9999800000	-0.9998000000
signedtest4a	0.1234500000	0.1234000000
signedtest4a	0.1234500000	0.1234000000
signedtest4a	0.1999900000	0.1999000000
signedtest4a	-0.1234500000	-0.1234000000
signedtest4a	-0.1999900000	-0.1999000000
signedtest4a	0.0000900000	0.0009000000
signedtest4a	-0.0000900000	-0.0009000000
signedtest4a	0.0000000000	0.0000000000
signedtest4a	NULL	NULL
CALL signeddeleteproc();
CALL signedinsertproc();
UPDATE cs1 SET d1=12345, d2=1234 WHERE d1 <= -99998 OR d2 >= 9998;
UPDATE cs2 SET d1=123456.90123, d2=12345.01234 WHERE d1 <= -99999.99998 OR d2 >= 99999.99998;
UPDATE cs3 SET d1=0.12345, d2=0.1234 WHERE d1 <= -0.99998 OR d2 >= 0.9998;
SELECT "signedtest4b", d1, d2 FROM cs1;
signedtest4b	d1	d2
signedtest4b	125	125
signedtest4b	-125	-125
signedtest4b	12345	1234
signedtest4b	12345	1234
signedtest4b	12345	1234
signedtest4b	12345	1234
signedtest4b	0	0
signedtest4b	NULL	NULL
SELECT "signedtest4b", d1, d2 FROM cs2;
signedtest4b	d1	d2
signedtest4b	1.2500000000	1.2500000000
signedtest4b	-1.2500000000	-1.2500000000
signedtest4b	123456.9012300000	12345.0123400000
signedtest4b	123456.9012300000	12345.0123400000
signedtest4b	123456.9012300000	12345.0123400000
signedtest4b	123456.9012300000	12345.0123400000
signedtest4b	1.1234567891	1.1234567891
signedtest4b	1.9999900000	1.9999900000
signedtest4b	-1.1234567891	-1.1234567891
signedtest4b	-1.9999900000	-1.9999900000
signedtest4b	1.0000000009	1.0000000009
signedtest4b	-1.0000000009	-1.0000000009
signedtest4b	0.0000000000	0.0000000000
signedtest4b	NULL	NULL
SELECT "signedtest4b", d1, d2 FROM cs3;
signedtest4b	d1	d2
signedtest4b	0.1250000000	0.1250000000
signedtest4b	-0.1250000000	-0.1250000000
signedtest4b	0.1234500000	0.1234000000
signedtest4b	0.1234500000	0.1234000000
signedtest4b	0.1234500000	0.1234000000
signedtest4b	0.1234500000	0.1234000000
signedtest4b	0.1234500000	0.1234000000
signedtest4b	0.1999900000	0.1999000000
signedtest4b	-0.1234500000	-0.1234000000
signedtest4b	-0.1999900000	-0.1999000000
signedtest4b	0.0000900000	0.0009000000
signedtest4b	-0.0000900000	-0.0009000000
signedtest4b	0.0000000000	0.0000000000
signedtest4b	NULL	NULL
CALL signeddeleteproc();
CALL signedinsertproc();
UPDATE cs1 SET d1=12345, d2=1234 WHERE d1 is NULL;
UPDATE cs2 SET d1=123456.90123, d2=12345.01234 WHERE d1 is NULL;
UPDATE cs3 SET d1=0.12345, d2=0.1234 WHERE d1 is NULL;
SELECT "signedtest5", d1, d2 FROM cs1;
signedtest5	d1	d2
signedtest5	125	125
signedtest5	-125	-125
signedtest5	99998	9998
signedtest5	99999	9999
signedtest5	-99998	-9998
signedtest5	-99999	-9999
signedtest5	0	0
signedtest5	12345	1234
SELECT "signedtest5", d1, d2 FROM cs2;
signedtest5	d1	d2
signedtest5	1.2500000000	1.2500000000
signedtest5	-1.2500000000	-1.2500000000
signedtest5	99999.9999800000	99999.9999800000
signedtest5	99999.9999900000	99999.9999900000
signedtest5	-99999.9999800000	-99999.9999800000
signedtest5	-99999.9999900000	-99999.9999900000
signedtest5	1.1234567891	1.1234567891
signedtest5	1.9999900000	1.9999900000
signedtest5	-1.1234567891	-1.1234567891
signedtest5	-1.9999900000	-1.9999900000
signedtest5	1.0000000009	1.0000000009
signedtest5	-1.0000000009	-1.0000000009
signedtest5	0.0000000000	0.0000000000
signedtest5	123456.9012300000	12345.0123400000
SELECT "signedtest5", d1, d2 FROM cs3;
signedtest5	d1	d2
signedtest5	0.1250000000	0.1250000000
signedtest5	-0.1250000000	-0.1250000000
signedtest5	0.9999800000	0.9998000000
signedtest5	0.9999900000	0.9999000000
signedtest5	-0.9999800000	-0.9998000000
signedtest5	-0.9999900000	-0.9999000000
signedtest5	0.1234500000	0.1234000000
signedtest5	0.1999900000	0.1999000000
signedtest5	-0.1234500000	-0.1234000000
signedtest5	-0.1999900000	-0.1999000000
signedtest5	0.0000900000	0.0009000000
signedtest5	-0.0000900000	-0.0009000000
signedtest5	0.0000000000	0.0000000000
signedtest5	0.1234500000	0.1234000000
CALL signeddeleteproc();
CALL signedinsertproc();
UPDATE cs1 SET d1=12345, d2=1234 WHERE d1 != 125;
UPDATE cs2 SET d1=123456.90123, d2=12345.01234 WHERE d1 != 1.25;
UPDATE cs3 SET d1=0.12345, d2=0.1234 WHERE d1 != 0.125;
SELECT "signedtest6", d1, d2 FROM cs1;
signedtest6	d1	d2
signedtest6	125	125
signedtest6	12345	1234
signedtest6	12345	1234
signedtest6	12345	1234
signedtest6	12345	1234
signedtest6	12345	1234
signedtest6	12345	1234
signedtest6	NULL	NULL
SELECT "signedtest6", d1, d2 FROM cs2;
signedtest6	d1	d2
signedtest6	1.2500000000	1.2500000000
signedtest6	123456.9012300000	12345.0123400000
signedtest6	123456.9012300000	12345.0123400000
signedtest6	123456.9012300000	12345.0123400000
signedtest6	123456.9012300000	12345.0123400000
signedtest6	123456.9012300000	12345.0123400000
signedtest6	123456.9012300000	12345.0123400000
signedtest6	123456.9012300000	12345.0123400000
signedtest6	123456.9012300000	12345.0123400000
signedtest6	123456.9012300000	12345.0123400000
signedtest6	123456.9012300000	12345.0123400000
signedtest6	123456.9012300000	12345.0123400000
signedtest6	123456.9012300000	12345.0123400000
signedtest6	NULL	NULL
SELECT "signedtest6", d1, d2 FROM cs3;
signedtest6	d1	d2
signedtest6	0.1250000000	0.1250000000
signedtest6	0.1234500000	0.1234000000
signedtest6	0.1234500000	0.1234000000
signedtest6	0.1234500000	0.1234000000
signedtest6	0.1234500000	0.1234000000
signedtest6	0.1234500000	0.1234000000
signedtest6	0.1234500000	0.1234000000
signedtest6	0.1234500000	0.1234000000
signedtest6	0.1234500000	0.1234000000
signedtest6	0.1234500000	0.1234000000
signedtest6	0.1234500000	0.1234000000
signedtest6	0.1234500000	0.1234000000
signedtest6	0.1234500000	0.1234000000
signedtest6	NULL	NULL
CALL signeddeleteproc();
CALL signedinsertproc();
UPDATE cs1 SET d2=d1 WHERE d1 = d2;
UPDATE cs2 SET d2=d1 WHERE d1 = d2;
UPDATE cs3 SET d2=d1 WHERE d1 = d2;
SELECT "signedtest7", d1, d2 FROM cs1;
signedtest7	d1	d2
signedtest7	125	125
signedtest7	-125	-125
signedtest7	99998	9998
signedtest7	99999	9999
signedtest7	-99998	-9998
signedtest7	-99999	-9999
signedtest7	0	0
signedtest7	NULL	NULL
SELECT "signedtest7", d1, d2 FROM cs2;
signedtest7	d1	d2
signedtest7	1.2500000000	1.2500000000
signedtest7	-1.2500000000	-1.2500000000
signedtest7	99999.9999800000	99999.9999800000
signedtest7	99999.9999900000	99999.9999900000
signedtest7	-99999.9999800000	-99999.9999800000
signedtest7	-99999.9999900000	-99999.9999900000
signedtest7	1.1234567891	1.1234567891
signedtest7	1.9999900000	1.9999900000
signedtest7	-1.1234567891	-1.1234567891
signedtest7	-1.9999900000	-1.9999900000
signedtest7	1.0000000009	1.0000000009
signedtest7	-1.0000000009	-1.0000000009
signedtest7	0.0000000000	0.0000000000
signedtest7	NULL	NULL
SELECT "signedtest7", d1, d2 FROM cs3;
signedtest7	d1	d2
signedtest7	0.1250000000	0.1250000000
signedtest7	-0.1250000000	-0.1250000000
signedtest7	0.9999800000	0.9998000000
signedtest7	0.9999900000	0.9999000000
signedtest7	-0.9999800000	-0.9998000000
signedtest7	-0.9999900000	-0.9999000000
signedtest7	0.1234500000	0.1234000000
signedtest7	0.1999900000	0.1999000000
signedtest7	-0.1234500000	-0.1234000000
signedtest7	-0.1999900000	-0.1999000000
signedtest7	0.0000900000	0.0009000000
signedtest7	-0.0000900000	-0.0009000000
signedtest7	0.0000000000	0.0000000000
signedtest7	NULL	NULL
CALL signeddeleteproc();
CALL signedinsertproc();
UPDATE cs1 SET d1=d2 WHERE d1 != d2;
UPDATE cs2 SET d1=d2 WHERE d1 != d2;
UPDATE cs3 SET d1=d2 WHERE d1 != d2;
SELECT "signedtest8", d1, d2 FROM cs1;
signedtest8	d1	d2
signedtest8	125	125
signedtest8	-125	-125
signedtest8	9998	9998
signedtest8	9999	9999
signedtest8	-9998	-9998
signedtest8	-9999	-9999
signedtest8	0	0
signedtest8	NULL	NULL
SELECT "signedtest8", d1, d2 FROM cs2;
signedtest8	d1	d2
signedtest8	1.2500000000	1.2500000000
signedtest8	-1.2500000000	-1.2500000000
signedtest8	99999.9999800000	99999.9999800000
signedtest8	99999.9999900000	99999.9999900000
signedtest8	-99999.9999800000	-99999.9999800000
signedtest8	-99999.9999900000	-99999.9999900000
signedtest8	1.1234567891	1.1234567891
signedtest8	1.9999900000	1.9999900000
signedtest8	-1.1234567891	-1.1234567891
signedtest8	-1.9999900000	-1.9999900000
signedtest8	1.0000000009	1.0000000009
signedtest8	-1.0000000009	-1.0000000009
signedtest8	0.0000000000	0.0000000000
signedtest8	NULL	NULL
SELECT "signedtest8", d1, d2 FROM cs3;
signedtest8	d1	d2
signedtest8	0.1250000000	0.1250000000
signedtest8	-0.1250000000	-0.1250000000
signedtest8	0.9998000000	0.9998000000
signedtest8	0.9999000000	0.9999000000
signedtest8	-0.9998000000	-0.9998000000
signedtest8	-0.9999000000	-0.9999000000
signedtest8	0.1234000000	0.1234000000
signedtest8	0.1999000000	0.1999000000
signedtest8	-0.1234000000	-0.1234000000
signedtest8	-0.1999000000	-0.1999000000
signedtest8	0.0009000000	0.0009000000
signedtest8	-0.0009000000	-0.0009000000
signedtest8	0.0000000000	0.0000000000
signedtest8	NULL	NULL
CALL signeddeleteproc();
CALL signedinsertproc();
UPDATE cs1 SET d1=12345, d2=1234 WHERE d1 < d2;
UPDATE cs2 SET d1=123456.90123, d2=12345.01234 WHERE d1 < d2;
UPDATE cs3 SET d1=0.12345, d2=0.1234 WHERE d1 < d2;
SELECT "signedtest9", d1, d2 FROM cs1;
signedtest9	d1	d2
signedtest9	125	125
signedtest9	-125	-125
signedtest9	99998	9998
signedtest9	99999	9999
signedtest9	12345	1234
signedtest9	12345	1234
signedtest9	0	0
signedtest9	NULL	NULL
SELECT "signedtest9", d1, d2 FROM cs2;
signedtest9	d1	d2
signedtest9	1.2500000000	1.2500000000
signedtest9	-1.2500000000	-1.2500000000
signedtest9	99999.9999800000	99999.9999800000
signedtest9	99999.9999900000	99999.9999900000
signedtest9	-99999.9999800000	-99999.9999800000
signedtest9	-99999.9999900000	-99999.9999900000
signedtest9	1.1234567891	1.1234567891
signedtest9	1.9999900000	1.9999900000
signedtest9	-1.1234567891	-1.1234567891
signedtest9	-1.9999900000	-1.9999900000
signedtest9	1.0000000009	1.0000000009
signedtest9	-1.0000000009	-1.0000000009
signedtest9	0.0000000000	0.0000000000
signedtest9	NULL	NULL
SELECT "signedtest9", d1, d2 FROM cs3;
signedtest9	d1	d2
signedtest9	0.1250000000	0.1250000000
signedtest9	-0.1250000000	-0.1250000000
signedtest9	0.9999800000	0.9998000000
signedtest9	0.9999900000	0.9999000000
signedtest9	0.1234500000	0.1234000000
signedtest9	0.1234500000	0.1234000000
signedtest9	0.1234500000	0.1234000000
signedtest9	0.1999900000	0.1999000000
signedtest9	0.1234500000	0.1234000000
signedtest9	0.1234500000	0.1234000000
signedtest9	0.1234500000	0.1234000000
signedtest9	-0.0000900000	-0.0009000000
signedtest9	0.0000000000	0.0000000000
signedtest9	NULL	NULL
CALL signeddeleteproc();
CALL signedinsertproc();
UPDATE cs1 SET d1=d2 WHERE d1 > d2;
UPDATE cs2 SET d1=d2 WHERE d1 > d2;
UPDATE cs3 SET d1=d2 WHERE d1 > d2;
SELECT "signedtest10", d1, d2 FROM cs1;
signedtest10	d1	d2
signedtest10	125	125
signedtest10	-125	-125
signedtest10	9998	9998
signedtest10	9999	9999
signedtest10	-99998	-9998
signedtest10	-99999	-9999
signedtest10	0	0
signedtest10	NULL	NULL
SELECT "signedtest10", d1, d2 FROM cs2;
signedtest10	d1	d2
signedtest10	1.2500000000	1.2500000000
signedtest10	-1.2500000000	-1.2500000000
signedtest10	99999.9999800000	99999.9999800000
signedtest10	99999.9999900000	99999.9999900000
signedtest10	-99999.9999800000	-99999.9999800000
signedtest10	-99999.9999900000	-99999.9999900000
signedtest10	1.1234567891	1.1234567891
signedtest10	1.9999900000	1.9999900000
signedtest10	-1.1234567891	-1.1234567891
signedtest10	-1.9999900000	-1.9999900000
signedtest10	1.0000000009	1.0000000009
signedtest10	-1.0000000009	-1.0000000009
signedtest10	0.0000000000	0.0000000000
signedtest10	NULL	NULL
SELECT "signedtest10", d1, d2 FROM cs3;
signedtest10	d1	d2
signedtest10	0.1250000000	0.1250000000
signedtest10	-0.1250000000	-0.1250000000
signedtest10	0.9998000000	0.9998000000
signedtest10	0.9999000000	0.9999000000
signedtest10	-0.9999800000	-0.9998000000
signedtest10	-0.9999900000	-0.9999000000
signedtest10	0.1234000000	0.1234000000
signedtest10	0.1999000000	0.1999000000
signedtest10	-0.1234500000	-0.1234000000
signedtest10	-0.1999900000	-0.1999000000
signedtest10	0.0000900000	0.0009000000
signedtest10	-0.0009000000	-0.0009000000
signedtest10	0.0000000000	0.0000000000
signedtest10	NULL	NULL
DROP PROCEDURE IF EXISTS signedinsertproc;
DROP PROCEDURE IF EXISTS signeddeleteproc;
DROP DATABASE update_signed_test;
